{
  "id": "0001",
  "title": "<short title>",
  "slug": "<slug>",
  "status": "draft",
  "artifact_paths": {
    "task": ".cbd/tasks/0001-<slug>.md",
    "contract": ".cbd/contracts/0001.contract.json",
    "evidence_json": ".cbd/reports/0001.evidence.json",
    "evidence": ".cbd/reports/0001.evidence.md"
  },
  "phases": {
    "plan": [
      {
        "step": "context",
        "status": "todo",
        "notes": ""
      },
      {
        "step": "draft_contract",
        "status": "todo",
        "notes": ""
      },
      {
        "step": "critique_contract",
        "status": "todo",
        "notes": ""
      },
      {
        "step": "revise_contract",
        "status": "todo",
        "notes": ""
      },
      {
        "step": "clarify_rounds",
        "status": "todo",
        "notes": ""
      },
      {
        "step": "set_ready",
        "status": "todo",
        "notes": ""
      }
    ],
    "build": [
      {
        "id": "WI-001",
        "owner": "build",
        "description": "TBD: implement the main code changes for this task.",
        "proves": [],
        "outputs": [],
        "status": "todo"
      },
      {
        "id": "WI-002",
        "owner": "test",
        "description": "TBD: add/extend tests proving the contract clause ids.",
        "proves": [],
        "outputs": [],
        "status": "todo"
      },
      {
        "id": "WI-003",
        "owner": "verify",
        "description": "Run `xtask cbd verify --id <id>` and update evidence.json with proof locations.",
        "proves": [],
        "outputs": [],
        "status": "todo"
      }
    ]
  }
}