{
  "id": "0002",
  "title": "Refactor xtask into modules",
  "slug": "xtask-modules-refactor",
  "status": "draft",
  "artifact_paths": {
    "task": ".cbd/tasks/0002-xtask-modules-refactor.md",
    "contract": ".cbd/contracts/0002.contract.json",
    "evidence_json": ".cbd/reports/0002.evidence.json",
    "evidence": ".cbd/reports/0002.evidence.md"
  },
  "phases": {
    "plan": [
      {
        "step": "context",
        "status": "done",
        "notes": "Reviewed xtask/src/main.rs for CLI definitions, helper utilities, and cbd subcommand handlers; captured the requested target module layout and invariants."
      },
      {
        "step": "draft_contract",
        "status": "done",
        "notes": "Drafted contract clauses for module layout, CLI surface, and validate-ready/verify exit code behavior; added acceptance tests and mapped clause ids to build/test work items."
      },
      {
        "step": "critique_contract",
        "status": "done",
        "notes": "Critique findings:\n- Scope/clauses mismatch: scope says keep full CLI behavior unchanged, but clauses only define validate-ready/verify plus CLI surface; new-task/new-epic/new-review behaviors (force/interactive/errors/output) are not specified.\n- Ready gate semantics: contract says \"has no open_questions\" but implementation treats missing/null as empty and wrong type as not ready; should codify this in clause/acceptance tests.\n- CLI surface invariant missing requiredness for --id/--slug on new-task/new-epic/new-review; add requiredness to make tests checkable.\n- Scaffolding invariants (XT-INV-008/009) are vague; tighten to explicit template comparison rules (output == template with placeholder substitution only).\n- artifact_paths.task points to missing task seed; ensure WI-007 creates it before set_ready."
      },
      {
        "step": "revise_contract",
        "status": "done",
        "notes": "Revised contract scope to match checkable behaviors; codified open_questions readiness semantics; clarified CLI requiredness; tightened scaffolding invariants and acceptance tests; updated scaffold test work item to match the detailed replacement rules."
      },
      {
        "step": "clarify_rounds",
        "status": "todo",
        "notes": ""
      },
      {
        "step": "set_ready",
        "status": "todo",
        "notes": ""
      }
    ],
    "build": [
      {
        "id": "WI-001",
        "owner": "build",
        "description": "Refactor xtask into modules: move clap CLI definitions to cli.rs, cbd dispatch/handlers to cbd/*, and shared helpers to util/* while keeping main.rs minimal.",
        "proves": [
          "XT-INV-001",
          "XT-INV-003",
          "XT-INV-004",
          "XT-INV-005",
          "XT-INV-006",
          "XT-INV-007"
        ],
        "outputs": [
          "xtask/src/main.rs",
          "xtask/src/cli.rs",
          "xtask/src/cbd/mod.rs",
          "xtask/src/cbd/new_task.rs",
          "xtask/src/cbd/new_epic.rs",
          "xtask/src/cbd/new_review.rs",
          "xtask/src/cbd/validate_ready.rs",
          "xtask/src/cbd/verify.rs",
          "xtask/src/util/mod.rs",
          "xtask/src/util/paths.rs",
          "xtask/src/util/fs.rs",
          "xtask/src/util/json.rs",
          "xtask/src/util/template.rs",
          "xtask/src/util/prompt.rs",
          "xtask/src/util/process.rs"
        ],
        "status": "todo"
      },
      {
        "id": "WI-002",
        "owner": "test",
        "description": "Add CLI surface and help-output tests for cbd subcommands (help exits 0; flags/args match contract including requiredness/defaults).",
        "proves": [
          "XT-INV-001",
          "XT-INV-002"
        ],
        "outputs": [
          "xtask/tests/contract_0002_cli.rs"
        ],
        "status": "todo"
      },
      {
        "id": "WI-003",
        "owner": "test",
        "description": "Add module layout and dependency list tests (main.rs minimal, cli.rs types, cbd/* handlers, util modules, Cargo.toml deps).",
        "proves": [
          "XT-INV-003",
          "XT-INV-004",
          "XT-INV-005",
          "XT-INV-006",
          "XT-INV-007"
        ],
        "outputs": [
          "xtask/tests/contract_0002_structure.rs"
        ],
        "status": "todo"
      },
      {
        "id": "WI-004",
        "owner": "test",
        "description": "Add scaffolding tests for interactive and non-interactive flows that assert template-driven replacements and JSON field updates per XT-INV-008/009.",
        "proves": [
          "XT-INV-008",
          "XT-INV-009"
        ],
        "outputs": [
          "xtask/tests/interactive_templates.rs",
          "xtask/tests/contract_0002_scaffold.rs"
        ],
        "status": "todo"
      },
      {
        "id": "WI-005",
        "owner": "test",
        "description": "Add validate-ready exit-code/output tests for missing/invalid/not-ready/ready cases.",
        "proves": [
          "VR-POST-001",
          "VR-ERR-001",
          "VR-ERR-002",
          "VR-ERR-003"
        ],
        "outputs": [
          "xtask/tests/contract_0002_validate_ready.rs"
        ],
        "status": "todo"
      },
      {
        "id": "WI-006",
        "owner": "test",
        "description": "Add verify exit-code/output tests for missing artifacts, invalid JSON/schema cases, readiness gate, coverage gaps, checks failing, and success.",
        "proves": [
          "VFY-POST-001",
          "VFY-ERR-001",
          "VFY-ERR-002",
          "VFY-ERR-003",
          "VFY-ERR-004",
          "VFY-ERR-005"
        ],
        "outputs": [
          "xtask/tests/contract_0002_verify.rs"
        ],
        "status": "todo"
      },
      {
        "id": "WI-007",
        "owner": "docs",
        "description": "Create task seed .cbd/tasks/0002-xtask-modules-refactor.md with scope/context aligned to the contract (or update artifact_paths.task if intentionally absent).",
        "proves": [],
        "outputs": [
          ".cbd/tasks/0002-xtask-modules-refactor.md"
        ],
        "status": "todo"
      },
      {
        "id": "WI-008",
        "owner": "verify",
        "description": "Run `xtask cbd verify --id 0002` and update evidence.json with proof locations.",
        "proves": [],
        "outputs": [],
        "status": "todo"
      },
      {
        "id": "WI-009",
        "owner": "review",
        "description": "Package a review archive and request a second-pass review (e.g., GPT-5.2 Pro).",
        "proves": [],
        "outputs": [],
        "status": "todo"
      }
    ]
  }
}
